{
  "id": "2f8d5b06-9c1e-4a73-b4d8-0e6a3c7f1d95",
  "mode": "auto",
  "device": "iphone",
  "startedAt": "2026-03-14T08:02:10.000Z",
  "state": "routed",
  "failedStep": null,
  "error": null,
  "segmentCount": 2,
  "audioSeconds": 14.9,
  "transcript": "Schreib das bitte in mein Journal und gib mir morgen früh eine Zusammenfassung.",
  "route": "hermes",
  "destinationRef": null,
  "replyText": null,
  "summary": null,
  "done": false,
  "favorite": false,
  "archived": false,
  "createdAt": "2026-03-14T08:02:10.301Z",
  "updatedAt": "2026-03-14T08:03:41.208Z"
}
