{
  "id": "7c9e2a10-5d4b-4e8f-a3b6-1f0d9c2e4a58",
  "mode": "journal",
  "device": "iphone",
  "startedAt": "2026-03-13T17:44:02.000Z",
  "state": "received",
  "failedStep": null,
  "error": null,
  "segmentCount": 3,
  "audioSeconds": null,
  "transcript": null,
  "route": null,
  "destinationRef": null,
  "replyText": null,
  "summary": null,
  "done": false,
  "favorite": false,
  "archived": false,
  "createdAt": "2026-03-13T17:44:02.250Z",
  "updatedAt": "2026-03-13T17:52:08.020Z"
}
