{
  "id": "5c2e9a17-84d3-4b60-a1f7-3e6d0b8c4a91",
  "mode": "hermes",
  "device": "iphone",
  "startedAt": "2026-03-14T09:45:12.000Z",
  "state": "transcribed",
  "failedStep": null,
  "error": null,
  "segmentCount": null,
  "audioSeconds": null,
  "transcript": "Remind me to book the dentist for next week.",
  "route": null,
  "destinationRef": null,
  "replyText": null,
  "summary": null,
  "typed": true,
  "done": false,
  "favorite": false,
  "archived": false,
  "createdAt": "2026-03-14T09:45:12.204Z",
  "updatedAt": "2026-03-14T09:45:12.204Z"
}
